[
  {
    "id": "rule_score_by_mood_001",
    "category": "score",
    "when": [
      "iniciando o corte ou estruturação de uma nova cena",
      "definindo a intenção emocional e o ritmo dos cortes"
    ],
    "recommend": [
      "inserir trilha temporária (temp track) antes de desenhar os sound effects",
      "escolher o gênero e instrumentação de acordo com o mood emocional da cena (heroico, tenso, calmo ou perseguição)"
    ],
    "avoid": [
      "editar vídeo e sound design em silêncio absoluto sem métrica musical",
      "utilizar trilhas alegres em cenas de suspense ou vice-versa"
    ],
    "reason": "A música define a métrica de tempo, tom dramático e contexto para que os sound effects sejam desenhados em harmonia.",
    "sourceChunks": [
      "sd_cont4_workflow_001",
      "sd_cont2_music_005"
    ],
    "confidence": "high"
  },
  {
    "id": "rule_ambience_location_002",
    "category": "ambience",
    "when": [
      "cena estabelece um novo ambiente ou localização espacial",
      "momentos de silêncio na narrativa onde não há diálogos"
    ],
    "recommend": [
      "adicionar ruído de fundo característico do local (ex: ar condicionado em escritório, vento em deserto, ondas em praia)",
      "manter o nível de ambiência sutil em segundo plano para preencher o vazio estéril"
    ],
    "avoid": [
      "deixar momentos sem som diegético gerando uma cena artificialmente morta",
      "aumentar a ambiência a ponto de disputar espaço com falas"
    ],
    "reason": "Na realidade nada é 100% silencioso; a ambiência confere textura, realismo e conforto auditivo contínuo.",
    "sourceChunks": [
      "sd_cont4_foley_reverb_003",
      "sd_cont3_automation_002",
      "sd_cont2_intent_003"
    ],
    "confidence": "high"
  },
  {
    "id": "rule_foley_visual_003",
    "category": "foley",
    "when": [
      "ações físicas visíveis na tela (digitação, escrita, passos, manuseio de papéis, trincos de porta)"
    ],
    "recommend": [
      "sonorizar os elementos presentes na imagem para sincronia realista",
      "utilizar variações de amostras ou gravar foley diretamente na timeline para evitar repetições idênticas"
    ],
    "avoid": [
      "repetir exatamente o mesmo arquivo de áudio para cada passo ou clique de teclado",
      "deixar ações visuais em primeiro plano desprovidas de som"
    ],
    "reason": "A ausência de foley ou a repetição robótica quebra a suspensão da descrença e soa amadora.",
    "sourceChunks": [
      "sd_cont4_foley_reverb_003",
      "sd_cont2_sfx_mod_007"
    ],
    "confidence": "high"
  },
  {
    "id": "rule_riser_reveal_004",
    "category": "riser",
    "when": [
      "antecedendo uma grande revelação, virada dramática, mudança de cena ou corte musical importante"
    ],
    "recommend": [
      "posicionar o riser de modo que seu crescimento antecipe a mudança",
      "alinhar o ataque final do riser precisamente no ponto de corte ou primeiro tempo do novo compasso"
    ],
    "avoid": [
      "usar risers longos em momentos banais sem desfecho visual correspondente",
      "interromper o riser antes de atingir seu ápice natural"
    ],
    "reason": "O riser gera expectativa no subconsciente do espectador e prepara a mente para a nova informação.",
    "sourceChunks": [
      "sd_cont3_taxonomy_001",
      "sd_cont2_music_005",
      "sd_cont3_three_sfx_003"
    ],
    "confidence": "high"
  },
  {
    "id": "rule_drone_suspense_005",
    "category": "drone",
    "when": [
      "cenas de mistério, investigação, perigo iminente ou quando algo importante ainda não foi revelado"
    ],
    "recommend": [
      "usar drones graves e contínuos para criar uma atmosfera densa e inquietante",
      "sustentar a frequência baixa como uma cama contínua que amplifica a gravidade da cena"
    ],
    "avoid": [
      "usar drones melódicos em excesso competindo com diálogos reflexivos",
      "cortar o drone de maneira seca sem cauda natural de sustentação"
    ],
    "reason": "Drones estimulam a percepção psicológica de perigo e suspense contínuo sem demandar elementos rítmicos.",
    "sourceChunks": [
      "sd_cont3_taxonomy_001",
      "sd_cont2_intent_003",
      "sd_cont4_score_edit_002"
    ],
    "confidence": "high"
  },
  {
    "id": "rule_whoosh_movement_006",
    "category": "whoosh",
    "when": [
      "movimentos rápidos de câmera (pans rápidos, whip pans), transições visuais ou ações dinâmicas de personagens"
    ],
    "recommend": [
      "adicionar whooshes e swooshes para acompanhar a trajetória do movimento visual",
      "usar whooshes para conferir dinamismo e leveza rítmica em edições estilizadas"
    ],
    "avoid": [
      "inserir whooshes em cortes lentos e contemplativos onde não há deslocamento de quadro",
      "utilizar whooshes com frequências excessivamente estridentes que causem fadiga auditiva"
    ],
    "reason": "O whoosh cria uma ponte auditiva que guia o olhar e torna as transições espaciais fluidas.",
    "sourceChunks": [
      "sd_cont3_taxonomy_001",
      "sd_cont4_abstract_004"
    ],
    "confidence": "high"
  },
  {
    "id": "rule_hit_punchline_007",
    "category": "hit",
    "when": [
      "revelação de informação chave, punchline em comédia, corte dramático ou virada narrativa"
    ],
    "recommend": [
      "aplicar um hit imediatamente no instante do impacto visual para marcar o evento",
      "alinhar o pico de transiente do hit ao frame exato da ação na timeline"
    ],
    "avoid": [
      "espalhar hits em todas as frases sem hierarquia de importância",
      "usar hits com ataques atrasados em relação ao corte"
    ],
    "reason": "Hits reforçam no cérebro a importância do elemento mostrado, pontuando a história como vírgulas e pontos finais sonoros.",
    "sourceChunks": [
      "sd_cont3_taxonomy_001",
      "sd_cont4_abstract_004",
      "sd_cont2_story_004"
    ],
    "confidence": "high"
  },
  {
    "id": "rule_boom_climax_008",
    "category": "boom",
    "when": [
      "clímax de cena, resolução de bloco, fechamento de título principal ou impacto de grande escala"
    ],
    "recommend": [
      "combinar sub-booms de baixa frequência com caudas de ressonância profunda",
      "reservar o boom para o ponto mais alto de energia da sequência"
    ],
    "avoid": [
      "usar booms graves em momentos secundários ou pausas momentâneas de ação",
      "acumular múltiplos booms consecutivos gerando embolamento no espectro sub-grave"
    ],
    "reason": "O boom transmite magnitude, finalização e peso monumental que só surtem efeito se não forem banalizados.",
    "sourceChunks": [
      "sd_cont4_restraint_005",
      "sd_cont2_story_004"
    ],
    "confidence": "high"
  },
  {
    "id": "rule_reverse_impact_009",
    "category": "reverse_impact",
    "when": [
      "antecedência imediata de um golpe, corte sinistro ou término de frase musical"
    ],
    "recommend": [
      "utilizar reverse cymbal (suck back) ou impacto invertido que suga o áudio em direção ao ponto de impacto",
      "casar o final do reverse exatamente com o transiente do hit seguinte"
    ],
    "avoid": [
      "deixar um intervalo de silêncio entre o final do efeito reverso e o início do impacto",
      "utilizar reverse excessivamente longo que desvie a atenção do diálogo prévio"
    ],
    "reason": "O reverse cria uma sucção acústica que aumenta exponencialmente a força do impacto subsequente.",
    "sourceChunks": [
      "sd_cont4_abstract_004",
      "sd_cont4_restraint_005",
      "sd_cont3_three_sfx_003"
    ],
    "confidence": "high"
  },
  {
    "id": "rule_transition_calcar_010",
    "category": "transition",
    "when": [
      "passagem entre duas cenas distintas ou transição entre temas de vídeo"
    ],
    "recommend": [
      "calçar a transição com 3 elementos: suporte central, antecipação crescente (riser) e ancoragem (hit/reverso)",
      "esconder cortes bruscos tornando o fluxo sonoro uma experiência contínua"
    ],
    "avoid": [
      "usar apenas fade-in e fade-out lineares amadores que revelam o corte",
      "deixar gaps de áudio vazios sem ambiência de transição"
    ],
    "reason": "Uma transição calçada em três pontos soa orgânica e guia a mente do público sem sobressaltos.",
    "sourceChunks": [
      "sd_cont3_three_sfx_003",
      "sd_cont1_eq_001",
      "sd_cont2_pause_006"
    ],
    "confidence": "high"
  },
  {
    "id": "rule_music_compass_011",
    "category": "music_editing",
    "when": [
      "fatiando, emendando ou trocando faixas musicais na timeline"
    ],
    "recommend": [
      "respeitar rigorosamente a contagem de 4 compassos (1, 2, 3, 4) para realizar cortes e viradas",
      "aproveitar as mudanças naturais de instrumentos no quarto compasso para introduzir novos temas"
    ],
    "avoid": [
      "cortar no segundo ou terceiro compasso sem justificativa dramática intencional",
      "emendar compassos de tempos métricos conflitantes sem transição de descanso"
    ],
    "reason": "O ouvido humano espera a conclusão da frase métrica no quarto compasso; respeitar isso evita dissonância rítmica.",
    "sourceChunks": [
      "sd_cont2_music_005",
      "sd_cont4_score_edit_002"
    ],
    "confidence": "high"
  },
  {
    "id": "rule_beat_alignment_012",
    "category": "beat_alignment",
    "when": [
      "alinhando cortes de imagem e efeitos de transição com a trilha sonora"
    ],
    "recommend": [
      "alinhar o corte do vídeo ao primeiro tempo forte (downbeat) do compasso musical",
      "visualizar a forma de onda (waveform) para identificar o pico exato do bumbo/caixa"
    ],
    "avoid": [
      "cortar 1 ou 2 frames antes ou depois do beat por falta de precisão na timeline",
      "sobrepor beats concorrentes de duas faixas com tempos (BPM) incompatíveis"
    ],
    "reason": "O sincronismo do estímulo visual com o pulso sonoro multiplica o impacto e a percepção de polimento da edição.",
    "sourceChunks": [
      "sd_cont2_music_005",